date,username,to,replies,retweets,favorites,text,geo,mentions,hashtags,id,permalink
3/14/2020 23:59,val_fare09,,0,0,5,I’m tired of joint pain and headaches. I’m tired of being 23 and feeling like an old person. I’m tired of doctors passing it off as being overweight or anxious when I’ve had this for years.,,,,1.23898E+18,https://twitter.com/val_fare09/status/1238977963930107909
7/28/2020 20:47,GamesRedDeer,,27,172,426,PLAY & Let The Fun Begin Like + RT + Click https://www.reddeergames.com Did You see it? pic.twitter.com/45a6EF3ixr,,,,1.28821E+18,https://twitter.com/GamesRedDeer/status/1288214494167158784
3/14/2020 23:52,Stushkaiser,,0,0,4,Coronavirus really gave depressed and anxious people a reason to isolate from the outside world. Safe to say we're winning.,,,,1.23898E+18,https://twitter.com/Stushkaiser/status/1238976337932627968
3/14/2020 23:52,Lissa_StillRISE,,0,0,0,Anxious to see how this night gonna go,,,,1.23898E+18,https://twitter.com/Lissa_StillRISE/status/1238976334497488899
3/14/2020 23:48,murrminks,,0,11,32,"A lot of this seems obvious, but here are some suggestions on what ppl w/ mental health struggles can do to keep from spiraling during quarantine lots of ppl (including me) tend to isolate themselves when they’re feeling depressed or anxious, so I thought these may help somebody pic.twitter.com/nau73HqPb8",,,,1.23898E+18,https://twitter.com/murrminks/status/1238975289457143808
3/14/2020 23:48,KateDufour,KellyGToGo,0,0,0,"First person narrative accounts are an important resource, and we need to be creating them! I picked up my journal today for the first time in years. As a bonus, it helped me to feel focused and less anxious about the future. #education #COVID19https://twitter.com/KellyGToGo/status/1238816677090873346 …",,,#education #COVID19https,1.23898E+18,https://twitter.com/KateDufour/status/1238975278824607744
3/14/2020 23:36,PHANNY_0601,,0,0,0,So anxious .....I honestly would rather be in san Luis,,,,1.23897E+18,https://twitter.com/PHANNY_0601/status/1238972399741263873
3/14/2020 23:36,DrShardeDavis,,0,0,1,I’m now aware that making friends in new cities is my means of survival when traveling for work. I fully recognize that I don’t have kids or elders to care for/entertain in this crisis... I’m simply expressing that the prospect of an umpteen-day quarantine makes me hella anxious!,,,,1.23897E+18,https://twitter.com/DrShardeDavis/status/1238972251946364928
3/14/2020 23:30,abby621,,1,2,29,"I’m an anxious person to start with and am not really cut out to handle a pandemic well. But one positive: I have been absolutely blown away by the response, communication and empathy coming from every level @SLU_Official and am proud to be a Billiken.",,@SLU_Official,,1.23897E+18,https://twitter.com/abby621/status/1238970741695094786
3/14/2020 23:29,coreyrpayne,,2,0,25,"About to give up trying (& failing) to work for a while. Seems the only thing I can manage to accomplish is sending emails anyway (sorry to my email recipients ) We're so programmed to be ""productive"" that I'm over here anxious about my lack of focus during a fucking pandemic",,,,1.23897E+18,https://twitter.com/coreyrpayne/status/1238970565966344195
3/14/2020 23:28,tounaka_e,,0,0,1,Living with anxiety in the time of #COVID19 is hard because I cant decide if I should be anxious or not but my ass over here vibin' to a song from animal crossing. pic.twitter.com/IJ5VGgF8xQ,,,#COVID19,1.23897E+18,https://twitter.com/tounaka_e/status/1238970312311672839
3/14/2020 23:27,joelycornholey,,1,0,6,Guys please don’t be anxious about getting to the stores if you already have enough daily essentials to last you. They’re gonna restock; this is not the end. You’re just making it harder for people who are almost out of things,,,,1.23897E+18,https://twitter.com/joelycornholey/status/1238970149111095296
3/14/2020 23:23,JenHues,,0,1,2,"Feeling anxious? Me, too. This photo has always been calming to me, so I thought I'd share. #calm #yellowstonelake #ynp @Yellowstone National Park https://www.instagram.com/p/B9u3sLYpcDG/?igshid=1azx4c14s3w39 …",,@Yellowstone,#calm #yellowstonelake #ynp,1.23897E+18,https://twitter.com/JenHues/status/1238968912177487873
3/14/2020 23:22,winemedineme,pinkrocktopus,1,0,6,Yeah I’m too everyday anxious to not be ready for this. I am enjoying the lack of people. https://twitter.com/pinkrocktopus/status/1238968329508917249 …,,,,1.23897E+18,https://twitter.com/winemedineme/status/1238968809614163969
3/14/2020 23:21,rickydoubles,,0,0,0,We in the carving mode... both anxious after a week off... diggin into this ;) @themartinezbros #dirtyrice,,@themartinezbros,#dirtyrice,1.23897E+18,https://twitter.com/rickydoubles/status/1238968531930120192
3/14/2020 23:21,CinqueThePrince,,0,0,0,Damn that coffee I drank earlier got me mad anxious,,,,1.23897E+18,https://twitter.com/CinqueThePrince/status/1238968517694640128
3/14/2020 23:16,allavelle,codykeenan,1,0,1,Felt a bit silly canceling my lunch plans today but also felt a bit anxious about keeping them. I think we made the right call. https://twitter.com/codykeenan/status/1238963943386873856 …,,,,1.23897E+18,https://twitter.com/allavelle/status/1238967153740722176
3/14/2020 23:14,MaryMamms,,0,1,0,I know it’s difficult not to feel anxious with everything that is happening in the world today. It’s human nature! BUT I’m here to tell you it’s okay to smile. C’mon you know you want to. Just look at this gorgeous… https://www.instagram.com/p/B9u2r08JX1f/?igshid=zxgzp6agvw3r …,,,,1.23897E+18,https://twitter.com/MaryMamms/status/1238966704681738245
3/14/2020 23:01,sarajohnsauce,,0,0,2,The Target employee collecting carts without gloves is making me ANXIOUS.,,,,1.23896E+18,https://twitter.com/sarajohnsauce/status/1238963383967367173
3/14/2020 22:54,Itss_Jordann,,0,0,9,Find out if I get my summer internship at midnight anxious is an understatement,,,,1.23896E+18,https://twitter.com/Itss_Jordann/status/1238961807689240576
3/14/2020 22:53,AmandaMoMorris,,1,0,0,"Seeing three separate parties going on too. Not meaning to condemn anyone on these tweets, but also, its interesting what exactly people are getting anxious about (airports) vs. not (parks) as areas of disease spread pic.twitter.com/oMQXMPFCdR",,,,1.23896E+18,https://twitter.com/AmandaMoMorris/status/1238961587865530368
3/14/2020 22:48,MsMaryOwen,naomiroslyn,1,0,2,He won. He has 2 little girls so he's extra anxious. This pandemic can just be stressful at times!! Stay healthy you!!,,,,1.23896E+18,https://twitter.com/MsMaryOwen/status/1238960133260095489
8/8/2020 15:30,VOANoticias,,0,2,9,"Betty Gabriela Rodríguez tiene como causa buscar oportunidades de desarrollo con equidad. Betty, una joven venezolana radicada en Washington DC., es la creadora de Amazona Foundation, organización enfocada en la labor social. #Venezuela360 https://bit.ly/2EZDu8B #VOANoticiaspic.twitter.com/b86Ej8yEbF",,,#Venezuela360 #VOANoticiaspic,1.29212E+18,https://twitter.com/VOANoticias/status/1292120885613039621
3/14/2020 22:43,auraedab,,0,2,9,"hey friends, if you're like me and feeling constantly anxious about everything atm, might I suggest meditation! It takes some practice but it def helps me feel like I'm regaining some control (Headspace is a great app for trying it out!)",,,,1.23896E+18,https://twitter.com/auraedab/status/1238959044381093889
3/14/2020 22:42,ClaudiaCCheeks,,1,0,3,Me starting to freak out cause I’m feeling a little shortness of breath... realizing I’m an anxious fat person so that’s my normal.,,,,1.23896E+18,https://twitter.com/ClaudiaCCheeks/status/1238958787484160000
3/14/2020 22:38,PBnJ23,KoiFGC,1,0,2,being here in person makes be less anxious actually and I'm very glad I came. the Atomsphere is very chill,,,,1.23896E+18,https://twitter.com/PBnJ23/status/1238957727189209088
3/14/2020 22:37,itsintheions,,0,0,0,all jokes aside if i wasn’t socially anxious and if i had my license i wouldn’t be here – at At Home,,,,1.23896E+18,https://twitter.com/itsintheions/status/1238957504383660040
3/14/2020 22:35,ConservBabes,,0,0,12,"“Do not be anxious about anything, but in every situation, by prayer and petition, with thanksgiving, present your requests to God. And the peace of God, which transcends all understanding, will guard your hearts… https://www.instagram.com/p/B9uyOQQjD3g/?igshid=1keczgezpwvit …",,,,1.23896E+18,https://twitter.com/ConservBabes/status/1238956894393454593
3/14/2020 22:20,keppenstall,,0,0,12,How do I tell my teacher who has now moved clarinet lessons over to Facetime that I get anxious when facetiming most people and hate doing it and that although I will comply I am so beyond burnt out to even sound well,,,,1.23895E+18,https://twitter.com/keppenstall/status/1238953233894141952
3/14/2020 22:16,kirkobainz,,0,1,4,Tips for my fellow anxious folks pic.twitter.com/fZDYa2xGE3,,,,1.23895E+18,https://twitter.com/kirkobainz/status/1238952050798383104
3/14/2020 22:14,FitWithMarilyn,Johnn_jr22,0,4,12,The one sound that INSTANTLY makes me anxious. https://twitter.com/Johnn_jr22/status/1238926270571806720 …,,,,1.23895E+18,https://twitter.com/FitWithMarilyn/status/1238951599214456832
3/14/2020 22:13,Solwrker,,2,0,5,Just listened to 3 episodes of #TheDailyPodcast by @nytimes. All about #COVID19. Informed and sad and anxious all at the same time. Now searching for puppy pics.,,@nytimes,#TheDailyPodcast #COVID19,1.23895E+18,https://twitter.com/Solwrker/status/1238951527416553473
3/14/2020 21:53,poetrygrljulia,,2,0,11,feeling very much like a prairie dog lately ... no cap. just chillin in a hole with anxious energy pic.twitter.com/7jdqQ3HGb9,,,,1.23895E+18,https://twitter.com/poetrygrljulia/status/1238946405512892423
3/14/2020 21:50,ceanthony50,FrancisSuarez,2,7,42,"The entire @leagueofcities family wishes you nothing but the best @FrancisSuarez. Sharing your story helps comfort those who may be anxious and afraid. May your health continue to improve, and thank you for your service to the @CityofMiamihttps://twitter.com/FrancisSuarez/status/1238846836372316160 …",,@leagueofcities @FrancisSuarez @CityofMiamihttps,,1.23895E+18,https://twitter.com/ceanthony50/status/1238945528978771968
3/14/2020 21:42,obyeeeeee,,0,0,0,"It was crazy, an anxious persons nightmare.",,,,1.23894E+18,https://twitter.com/obyeeeeee/status/1238943640543789056
3/14/2020 21:37,AGIREaguirre,,0,0,4,My anxious ass watching y'all get drunk rn pic.twitter.com/AdfgxjwfrF,,,,1.23894E+18,https://twitter.com/AGIREaguirre/status/1238942350870601728
3/14/2020 21:32,covercash,LizSetsFire,0,0,0,"Movie made me so anxious, if I watched it right now my heart rate would hit 200bpm.",,,,1.23894E+18,https://twitter.com/covercash/status/1238941079833120768
3/14/2020 21:32,andrewkimmel,,17,0,74,I didn’t have much contact with friends/family until the last week of being sick. None became ill that I know. I was feeling about 75% better when I traveled to Europe on Jan 24. Could this all be in my head? Yes. But I’m anxious that this has been here longer than we think.,,,,1.23894E+18,https://twitter.com/andrewkimmel/status/1238941031610986496
3/14/2020 21:26,hickory66,,4,38,60,"I am anxious to get the Wuhan Virus over so we can have a Trump vs Biden debate. That is if he has not been sent to jail with his deadbeat son named, “Where is Hunter?” pic.twitter.com/H1XGagzpTh",,,,1.23894E+18,https://twitter.com/hickory66/status/1238939565852954627
3/14/2020 21:23,divaquise,,2,1,16,"I can’t decide if I should just live my life as anxious free as possible, or freak the fuck out like everyone at this point... I’m at a loss. pic.twitter.com/miIreGzs0Y",,,,1.23894E+18,https://twitter.com/divaquise/status/1238938873117450241
3/14/2020 21:18,theashleyray,,0,0,2,the newest ep of high maintenance made me very anxious and I didn't like it,,,,1.23894E+18,https://twitter.com/theashleyray/status/1238937502204870656
3/14/2020 21:08,kwintheshooter,IAmMarkManson,0,0,3,Way to fn much. Then you try to calm down and the calming down makes you anxious because you can’t de-anxious,,,,1.23894E+18,https://twitter.com/kwintheshooter/status/1238935161049358336
3/14/2020 20:53,angel_fwtx,,1,0,2,"Please be alert not anxious. The COVID-19 situation is evolving rapidly. Be prepared but do not stock up on everything in the store, including toilet paper. The “it will stay over there” mentality has run out. It is here. The current death rate of the average person from (1)",,,,1.23893E+18,https://twitter.com/angel_fwtx/status/1238931289606172673
7/28/2020 20:47,GamesRedDeer,,27,172,426,PLAY & Let The Fun Begin Like + RT + Click https://www.reddeergames.com Did You see it? pic.twitter.com/45a6EF3ixr,,,,1.28821E+18,https://twitter.com/GamesRedDeer/status/1288214494167158784
3/14/2020 20:45,satan_spice,,0,0,5,I’m so anxious about work stuff that I could barely sleep last night. I keep trying to force myself back to sleep because I just don’t want to be awake with these thoughts but it’s not working. Ugh.,,,,1.23893E+18,https://twitter.com/satan_spice/status/1238929329234444288
3/14/2020 20:37,cobbkitties,,0,16,9,"UPDATE FROM THE SHELTER: Part 1 Riley is a 3yr, 19lb, Russian Blue mix. He was surrendered to the shelter 3/13 because the owner said he was anxious in the home. Riley is extremely obese and front declawed.",,,,1.23893E+18,https://twitter.com/cobbkitties/status/1238927172007530496
3/14/2020 20:25,kill_conformity,,0,0,1,Every time I realign my inner self it’s the same anxious shit that throws me off again. I’m tired,,,,1.23892E+18,https://twitter.com/kill_conformity/status/1238924292919717888
3/14/2020 20:19,FatBoi843,,0,0,0,We're thankful for the sun shining today and we're anxious to move this along and for our community to bounce back said Cookeville Mayor Ricky Shelton in a Wednesday press conference,,,,1.23892E+18,https://twitter.com/FatBoi843/status/1238922640204627969
3/14/2020 20:15,TweetsFromTommy,ByCasagrande,0,0,0,"I was anxious about the virus, not anymore. The hero we need, not the hero we deserve. https://twitter.com/ByCasagrande/status/1238909010155315200 …",,,,1.23892E+18,https://twitter.com/TweetsFromTommy/status/1238921735501684737
3/14/2020 20:14,ToddGongwer,UACoachMurphy,1,0,1,Yessss!!!! I’ll be anxious to hear how it goes Coach!,,,,1.23892E+18,https://twitter.com/ToddGongwer/status/1238921423244201986
3/14/2020 20:11,AngelWilson36,,1,3,31,"Be anxious for nothing but in everything, by prayer and supplication, with thanksgiving, let your requests be made known to God and the peace of God which surpasses all understanding will keep your hearts and mind in Christ Jesus. ~Philippians 4:6-7",,,,1.23892E+18,https://twitter.com/AngelWilson36/status/1238920753430564864
3/14/2020 20:04,everwood_lynn,,1,1,0,I'm sure you have been following the news and it's just getting scary! Many are worried and anxious about what's ahead and how we can be prepared.,,,,1.23892E+18,https://twitter.com/everwood_lynn/status/1238919047409999877
3/14/2020 20:01,MeganJuracek,MVphotoFox10,0,0,0,"This is how I ended up with Wilson! I was anxious and still heartbroken over losing Cheech and George, but he needed a home, I had room in mine, and it cost me nothing. If you’re in the valley, go find yourself a new friend!! https://twitter.com/MVphotoFox10/status/1238895946240380928 …",,,,1.23892E+18,https://twitter.com/MeganJuracek/status/1238918231252819968
3/14/2020 19:59,wakeupkam,,0,0,0,Being indecisive makes me anxious.,,,,1.23892E+18,https://twitter.com/wakeupkam/status/1238917658340458497
3/14/2020 19:57,tedalexandro,,1,0,17,"7/11 In the macro, I’m aware of how many people are suffering and will be- physically, psychologically, emotionally and financially. I’ve felt anxious and already had several conversations with friends who are suffering with anxiety and depression exacerbated by the pandemic.",,,,1.23892E+18,https://twitter.com/tedalexandro/status/1238917153857982465
3/14/2020 19:57,beeteeth,,0,0,6,Also having wild empathy epiphanies for people who are normally socially/germ anxious,,,,1.23892E+18,https://twitter.com/beeteeth/status/1238917084219924491
3/14/2020 19:53,voidnoise47,,0,0,5,@the lady who was really nice to me while checking out at whole foods today bc I forgot my card in the car- hope ur havin a good day I was so anxious about it,,@the,,1.23892E+18,https://twitter.com/voidnoise47/status/1238916105453756416
3/14/2020 19:38,HelloGlamazon,ShonePatrol,0,0,0,It made me feel less anxious.,,,,1.23891E+18,https://twitter.com/HelloGlamazon/status/1238912427766538240
3/14/2020 19:36,saltlifelopez,,1,0,0,i tell my gf i’m gonna spoil her and she gets ANXIOUS bc she never knows what she’s gonna get,,,,1.23891E+18,https://twitter.com/saltlifelopez/status/1238911940988227590
3/14/2020 19:33,DanielJLacey,,0,0,1,"“Do not be anxious about anything, but in every situation, by prayer and petition, with thanksgiving, present your requests to God. And the peace of God, which transcends all understanding, will guard your hearts and your minds in Christ Jesus.” - Philippians 4:6-7",,,,1.23891E+18,https://twitter.com/DanielJLacey/status/1238911129243402240
3/14/2020 19:31,buddy_ferrara,chicagolucy,2,0,1,Anxious & depressed but doing our best,,,,1.23891E+18,https://twitter.com/buddy_ferrara/status/1238910560588247040
3/14/2020 19:28,natural_wanders,,0,0,0,"Pandemic Prescription: Vitamin N(ature). As we navigate the #coronavirus outbreak #COVID19 it’s natural to feel overwhelmed and anxious. Here are some tips to Boost Your #ImmuneSystem and Calm Your Mind, Naturally: https://www.naturalwanders.us/blog/pandemic-prescription-vitamin-nature …",,,#coronavirus #COVID19 #ImmuneSystem,1.23891E+18,https://twitter.com/natural_wanders/status/1238909918750662662
3/14/2020 19:25,DerekVreeland,,2,1,3,"Friends, in these anxious and difficult days there are little miracles and signs of life all around us. You just have to keep looking for them. (: @jvreeland)pic.twitter.com/3i3Z7l2bgy",,@jvreeland,,1.23891E+18,https://twitter.com/DerekVreeland/status/1238909222613647360
3/14/2020 19:23,TreeEyes,,0,0,0,I’m so anxious with all of this #coronavirus news esp here in Florida. #WDW NOT OPERATING: Disney Skyliner Express Monorail connecting the Transportation & Ticket Center to the Magic Kingdom Park Buses connecting on-site resorts to the parks Related,,,#coronavirus #WDW,1.23891E+18,https://twitter.com/TreeEyes/status/1238908636287643651
7/28/2020 20:47,GamesRedDeer,,27,172,426,PLAY & Let The Fun Begin Like + RT + Click https://www.reddeergames.com Did You see it? pic.twitter.com/45a6EF3ixr,,,,1.28821E+18,https://twitter.com/GamesRedDeer/status/1288214494167158784
3/14/2020 19:22,mixedupclothing,,1,0,2,"Pre #COVID19 today would have been spent trying to figure out how to b at my daughter’s softball game & my sons’ baseball games. I woulda felt anxious & guilty 4 missing parts or all of each. Today we’re home, they’re lounging on my bed & we’ve queued up @netflix #happymama",,@netflix,#COVID19 #happymama,1.23891E+18,https://twitter.com/mixedupclothing/status/1238908379055063040
3/14/2020 19:11,anothercami,,0,0,0,I am starting to feel so fucking anxious being stuck inside the house,,,,1.23891E+18,https://twitter.com/anothercami/status/1238905601889050629
3/14/2020 19:08,row_zik_ee,,0,0,13,"Feeling lonely? Nervous or anxious? Isolated? Stir crazy? Social distancing doesn’t HAVE to mean social isolation! If you’re feeling any things, feel free to txt or (better yet) FaceTime me!!!! Let’s keep each other company",,,,1.2389E+18,https://twitter.com/row_zik_ee/status/1238904922764120065
3/14/2020 19:08,JulieAlexandria,,0,0,4,"Fear is a choice, danger is real. In these uncertain times, one thing is for certain: there is so much we can do that is still within our power to control. If the news/ media is making you anxious, turn it off. If… https://www.instagram.com/p/B9uajc3HMkA/?igshid=10t2l4zl1o15z …",,,,1.2389E+18,https://twitter.com/JulieAlexandria/status/1238904845412769794
3/14/2020 19:04,CrazyOnYou,,0,0,0,"When my anxious thoughts multiply within me, Your consolations delight my soul. Psalms 94:19 NASB @F3rdLM @F3Prayers #Overwhelm https://bible.com/bible/100/psa.94.19.NASB …pic.twitter.com/ZFBh2uAq9o",,@F3rdLM @F3Prayers,#Overwhelm,1.2389E+18,https://twitter.com/CrazyOnYou/status/1238903909193744389
3/14/2020 19:01,jsg402,,3,3,44,"I was feeling shitty and anxious, but then I took MALORIE on a road trip. Review coming later today... pic.twitter.com/zDnNYjGysN – at Old Mackinac Point Lighthouse",,,,1.2389E+18,https://twitter.com/jsg402/status/1238903031225335808
3/14/2020 18:59,LeeAbbamonte,,1,0,32,I literally never go to the grocery store. But I’ve been 4x in the last 24 hrs. The checkout/baggage people & shelf stockers deserve gold medals for being amazing dealing with anxious customers & potentially risking their own health. It’s very much appreciated. #coronavirus #NYC,,,#coronavirus #NYC,1.2389E+18,https://twitter.com/LeeAbbamonte/status/1238902661921099779
3/14/2020 18:59,RiverChau,,1,0,0,"Considering I started feeling more anxious yesterday while keeping tabs on #coronavirus, I’m going to try and not consume any news today. Wish me luck.",,,#coronavirus,1.2389E+18,https://twitter.com/RiverChau/status/1238902504601071621
3/14/2020 18:58,nesscrisp,,0,1,0,JUST BECAUSE SOMEONE DOESNT LOOK VISUALLY ANXIOUS DOESNT MEAN YOU HAVE THE RIGHT TO THEM TO CALM DOWN,,,,1.2389E+18,https://twitter.com/nesscrisp/status/1238902402914402304
3/14/2020 18:56,PsychosocialBlg,,0,1,0,With everything going on right now it’s hard to not feel anxious. It’s also hard to not feel isolated staying in and avoiding crowded spaces. So here are a few suggestions on things you can do this weekend indoors!… https://www.instagram.com/p/B9uZIsunDe0/?igshid=nl4oz0w1qpu9 …,,,,1.2389E+18,https://twitter.com/PsychosocialBlg/status/1238901727442722816
3/14/2020 18:54,seemore9,,0,0,0,"Ooh,I’m as anxious to see the results of dumpf’s Coronovirus test as I am to see the results of his next physical,where the doctor says he’s 7’10”, 180 lbs and has grown bionic muscles.. Ooh, what’s that, the result is “negative.” I asked for the virus result, not his IQ score.",,,,1.2389E+18,https://twitter.com/seemore9/status/1238901273182769154
3/14/2020 18:51,elizacranepoet,,0,0,0,"These calming activities help me when I am sad and anxious at home, which has been the past few days! Check out my blog post on ways to destress for cheap or free: https://hyggeblogge.com/2020/03/09/calming-activities/ … #destress #blogpost #educator",,,#destress #blogpost #educator,1.2389E+18,https://twitter.com/elizacranepoet/status/1238900629474627585
3/14/2020 18:44,McCrobieLV,,0,0,0,"“Do not #fear: I am with you; Do not be #anxious: I am your God. I will #strengthen you, I will #help you.” (Isaiah 41:10). #COVIDー19 #CatholicTwitter @MagnificatMag @USCatholic",,@MagnificatMag @USCatholic,#fear #anxious #strengthen #help #COVIDー19 #CatholicTwitter,1.2389E+18,https://twitter.com/McCrobieLV/status/1238898865329364992
3/14/2020 18:41,AdrienneZCooper,,0,0,0,"Has the news from the past several days left you anxious, panicked, and stressed? Research shows touch has a calming effect, thus helping to relieve stress, reduces anxiety, promotes relaxation to help you sleep… https://www.instagram.com/p/B9uXb-9AGaD/?igshid=enmwl135b20i …",,,,1.2389E+18,https://twitter.com/AdrienneZCooper/status/1238897987197296640
3/14/2020 18:35,brianmclaren,CoryBooker,1,3,69,"Yes. I just flew home and felt the same way about airport and airline staff. Thank you, thank you, for being there for weary and anxious travellers. https://twitter.com/CoryBooker/status/1238876476293996544 …",,,,1.2389E+18,https://twitter.com/brianmclaren/status/1238896662539632640
3/14/2020 18:34,MilaB07532762,AnnCoulter,0,0,0,"Yes, we are all anxious to hear that!",,,,1.2389E+18,https://twitter.com/MilaB07532762/status/1238896383538716672
3/14/2020 18:33,JoelEdmonson,SarcasticEC,1,0,0,"He was off to a good start. Was the Sunday starter, which is not real common for a Freshman, was anxious to see how he developed during the year. I guess we have to wait.",,,,1.2389E+18,https://twitter.com/JoelEdmonson/status/1238896119863750657
3/14/2020 18:32,southsidedoll,,1,0,2,I was there for less than 10 minutes and felt very anxious. People were running to grab things and yelling.,,,,1.2389E+18,https://twitter.com/southsidedoll/status/1238895828678463493
3/14/2020 18:29,greyton1,,0,0,0,"This COVID19 thing has me feelin anxious not so much about getting it as I’m doing all the right things. It’s more about the block long lines at the grocery, people hoarding items, price gauging, schools and… https://www.instagram.com/p/B9uWEG2DRzc/?igshid=fx0o9kiazpnp …",,,,1.23889E+18,https://twitter.com/greyton1/status/1238894972214161409
3/14/2020 18:22,HGBrewster,ShineText,0,0,0,"Here’s a website that helps you deal with corona virus anxiety. It looks pretty helpful for those of us who have anxiety disorder, or if you’re just feeling anxious about corona virus. https://twitter.com/ShineText/status/1238423316060426241 …",,,,1.23889E+18,https://twitter.com/HGBrewster/status/1238893372129136647
7/28/2020 20:47,GamesRedDeer,,27,172,426,PLAY & Let The Fun Begin Like + RT + Click https://www.reddeergames.com Did You see it? pic.twitter.com/45a6EF3ixr,,,,1.28821E+18,https://twitter.com/GamesRedDeer/status/1288214494167158784
3/14/2020 18:22,beekayroot,,0,0,8,"I'm on my way back to Pennsylvania with a group of about 20 students. We've been dealing with the coronavirus news together this week, and we're all a little anxious to get nack to Greensburg tomorrow.",,,,1.23889E+18,https://twitter.com/beekayroot/status/1238893160702586880
