date,username,to,replies,retweets,favorites,text,geo,mentions,hashtags,id,permalink
3/14/2020 2:38,revtxnva,MichaelRWear,0,0,1,She’s beautiful. May you and yours be blessed in these anxious days by the joy of her presence in your lives. And keep up your good work.,,,,1.23866E+18,https://twitter.com/revtxnva/status/1238655785032351745
3/14/2020 2:38,SaraMichele,,0,0,1,"This has been a WEEK. I have never felt more anxious, but trying to stay positive, healthy and in the moment. pic.twitter.com/HiKWe209pe",,,,1.23866E+18,https://twitter.com/SaraMichele/status/1238655722470232068
3/14/2020 2:33,meganhaley_,,0,0,0,And it’s the worse when there’s no specific reason you just be anxious to be anxious tf ... who created this bs,,,,1.23865E+18,https://twitter.com/meganhaley_/status/1238654421237731330
3/14/2020 2:28,paulsalsabar,,1,3,9,seeing people complain about having to still go to work when my friends and colleagues are over here unexpectedly laid off and anxious about when we’ll work again,,,,1.23865E+18,https://twitter.com/paulsalsabar/status/1238653298531418113
3/14/2020 2:10,ChristiSpindle,,0,0,1,"She’s deaf, but she hears your heart. She’s almost blind, but she sees your soul. She gets anxious and confused, but she loves with her whole heart. She loves snuggles, and she will share… https://www.instagram.com/p/B9smGs6Hu3SiwOMNAYSsp-2me5E7e9IbDhx3840/?igshid=1oxvd3wjo4pev …",,,,1.23865E+18,https://twitter.com/ChristiSpindle/status/1238648769543094272
3/14/2020 2:00,Go_JoannaGo,,1,0,1,"It’s natural to feel uneasiness right now—if you find yourself feeling anxious about your safety or the safety of others—take a break, do some #selfcare. Turn off the news/social media. Drink water + eat healthy food. Rely on your friends & social support networks. #NetflixParty?",,,#selfcare #NetflixParty,1.23865E+18,https://twitter.com/Go_JoannaGo/status/1238646178398343169
3/14/2020 1:58,AynW,KimmyMonte,0,0,1,"Anne New Orleans Plenty of supplies, but pretty anxious/all over the place.",,,,1.23865E+18,https://twitter.com/AynW/status/1238645687547506690
3/14/2020 1:54,brandonlaw_wx,,2,0,17,"Just a week ago I was soaking up the sunshine in Florida with the people I love the most. Tonight, it seems like that trip was an eternity ago. This week has been VERY taxing on all of us, and I’ve been incredibly anxious, too. But hey- we’ll get through this together! pic.twitter.com/ys9NBvTlTS",,,,1.23864E+18,https://twitter.com/brandonlaw_wx/status/1238644681485029377
3/14/2020 1:51,nitroslick,,0,0,1,"All right, all this coronavirus chatter is making me even more anxious than usual. Can @Nintendo just release #AnimalCrossingNewHorizons early?pic.twitter.com/nwS5gvG3b9",,@Nintendo,#AnimalCrossingNewHorizons,1.23864E+18,https://twitter.com/nitroslick/status/1238643879030726656
3/14/2020 1:44,asek47,,0,5,8,"Folks stressed by #Covid_19 #CancelEverything: You are not alone! It’s not just ok, but *good* to ask for help if you’re feeling anxious or overwhelmed. Employers, schools, and @mindyourmind_ca have great resources for people who don’t know where to turn.https://mindyourmind.ca/help/where-call",,@mindyourmind_ca,#Covid_19 #CancelEverything,1.23864E+18,https://twitter.com/asek47/status/1238642245210800128
7/28/2020 20:47,GamesRedDeer,,27,172,426,PLAY & Let The Fun Begin Like + RT + Click https://www.reddeergames.com Did You see it? pic.twitter.com/45a6EF3ixr,,,,1.28821E+18,https://twitter.com/GamesRedDeer/status/1288214494167158784
3/14/2020 1:44,samanthaw1192,,1,0,4,My work just closed for two weeks but is generously giving us two weeks pay while it happens but I’m fkn ANXIOUS. What do I even do for that long?!,,,,1.23864E+18,https://twitter.com/samanthaw1192/status/1238642060938248193
3/14/2020 1:41,jws_23,,0,0,2,Just ridiculously good. - Drinking an Anxious by Lua Brewing @Lua Brewing — http://untp.beer/s/c877686195,,@Lua,,1.23864E+18,https://twitter.com/jws_23/status/1238641419557969920
3/14/2020 1:41,tiinyraisin,,1,1,1,anxious – at Ralphs,,,,1.23864E+18,https://twitter.com/tiinyraisin/status/1238641350104367117
3/14/2020 1:40,lobotamybarbie,hazey_xo,1,0,0,"Ya it is possible for someone to feel anxious w/o having an anxiety disorder. But it isn’t that hard to recognize an anxiety disorder lol it’s like, u don’t need to go to a licensed professional to tell u that u have a headache when ur head hurts. Lol. Why can’t she speak on it?",,,,1.23864E+18,https://twitter.com/lobotamybarbie/status/1238641197121302528
3/14/2020 1:36,carolslafferty,joshgad,0,0,0,"Thank you for doing this! Helps calm some very anxious kiddos . . . and me, too!",,,,1.23864E+18,https://twitter.com/carolslafferty/status/1238640054647566336
3/14/2020 1:22,vmitvf,,2,0,5,Holding me back from a loved ones funeral cause we can’t be “selfish” and fly out is fucken stupid. Ruined my whole mood now I’ll wait for the response and be anxious for a while ty we love the marine corps :)))),,,,1.23864E+18,https://twitter.com/vmitvf/status/1238636633118969858
3/14/2020 1:19,2stepnmonkey,daBoonePope,0,0,1,Me too...anxious to get him back!,,,,1.23864E+18,https://twitter.com/2stepnmonkey/status/1238635939590742016
3/14/2020 1:18,nkantar,,1,0,0,• Send more explicit and serious reassurance to those who seem to be the most anxious. 4/5,,,,1.23864E+18,https://twitter.com/nkantar/status/1238635491160756224
3/14/2020 1:15,lovethatspittah,,0,0,0,So anxious to move into my apartment but at the same time im nervous,,,,1.23863E+18,https://twitter.com/lovethatspittah/status/1238634737289367552
3/14/2020 1:10,umhsllc,,0,0,0,"When you hear, read, or watch #news about an #outbreak of an infectious #disease such as #coronavirus , you may feel anxious and show signs of stress. Know the signs of #stress in yourself and your loved ones. Know how to relieve stress, and know when to get #help.pic.twitter.com/bXJkwJfse6",,,#news #outbreak #disease #coronavirus #stress #help,1.23863E+18,https://twitter.com/umhsllc/status/1238633601685762054
3/14/2020 1:05,cassbutlerxo,,0,0,5,i don’t know why 7 cop cars and two under covers just blew by me but it makes me very anxious,,,,1.23863E+18,https://twitter.com/cassbutlerxo/status/1238632367696367623
3/14/2020 1:03,joninjaa,,0,0,3,I went to the grocery stores today and I got hella anxious being there pic.twitter.com/3RC3YO7qW4,,,,1.23863E+18,https://twitter.com/joninjaa/status/1238631930855215104
3/14/2020 1:00,trinaquintanaxo,,0,0,0,Anxiety sucks.... tired of living with feeling so anxious especially when it’s out of no where.,,,,1.23863E+18,https://twitter.com/trinaquintanaxo/status/1238631039645306881
3/14/2020 0:55,pmiscove,,4,0,15,"Since I’m already an anxious, emotional wreck...might as well watch Up pic.twitter.com/O0psO0nVg1",,,,1.23863E+18,https://twitter.com/pmiscove/status/1238629805261615104
3/14/2020 0:52,a_monique94,MOD_Ent88,1,0,1,I am just Anxious usually and being late gives me too much extra shit,,,,1.23863E+18,https://twitter.com/a_monique94/status/1238629075742339073
3/14/2020 0:52,pinko_machinist,PasturesPolitic,0,5,7,Blesséd are the Anxious for they shall inherit the Earth https://twitter.com/PasturesPolitic/status/1238625247273914369 …,,,,1.23863E+18,https://twitter.com/pinko_machinist/status/1238628968410091523
3/14/2020 0:51,jkobak,NYCMayor,2,6,57,You must be kidding me. you DONT know what it’s like as a teacher attempting to teach during this pandemic but being scared and anxious for your heath and your students health. There had been nothing like this in our lifetime so you cannot possibly understand.,,,,1.23863E+18,https://twitter.com/jkobak/status/1238628782686244865
3/14/2020 0:49,RVoronaCote,,4,3,31,~As a queer lady~ the true mark of my pandemic-rooted terror will be whether I feel anxious watching Rachel Weisz spit into another woman’s mouth rather than pleasantly flustered.,,,,1.23863E+18,https://twitter.com/RVoronaCote/status/1238628392028852231
3/14/2020 0:49,kazemicode,adibkhorram,0,0,1,"As someone with an actual anxiety disorder I have this weird thing that I feel less anxious when people are panicking around me. I dunno what that means, but I’m having a fine time social distancing",,,,1.23863E+18,https://twitter.com/kazemicode/status/1238628172712689664
3/14/2020 0:47,MattTalhelm,,1,1,26,"A much needed evening to decompress after the stressful and anxious week we’ve all experienced. Enjoying the warm weather, @kingvineyards wine, & amazing food at Public Fish & Oyster in #Charlottesville. Get out and support local businesses! They’re going to need the love!pic.twitter.com/uAp422pniW",,@kingvineyards,#Charlottesville,1.23863E+18,https://twitter.com/MattTalhelm/status/1238627824593973249
7/28/2020 20:47,GamesRedDeer,,27,172,426,PLAY & Let The Fun Begin Like + RT + Click https://www.reddeergames.com Did You see it? pic.twitter.com/45a6EF3ixr,,,,1.28821E+18,https://twitter.com/GamesRedDeer/status/1288214494167158784
3/14/2020 0:45,valerieannagnes,ielizabeth_,0,0,1,"Glass half full. Glass half empty. Glass cracked. Glass broken. When you feel down, grab a glass and come on twitter. You'll likely find a friend is here. When things feel too tough though, you gotta get support closer to home. It is reasonable to feel sad and anxious right now.",,,,1.23863E+18,https://twitter.com/valerieannagnes/status/1238627325501214720
3/14/2020 0:38,realzachfluke1,BenjaminPDixon,0,0,2,"I feel desperate, near defeated, anxious, & gaslighted (gaslit?). I feel a huge burden on my chest, nearly panicking when I worry about Bernie not saying/doing *everything* he needs to end Joe Biden’s run. My family needs Bernie. We can’t afford to ask “What if”. Bernie is it.",,,,1.23863E+18,https://twitter.com/realzachfluke1/status/1238625467424481281
3/14/2020 0:33,bryan_cottrill,,1,0,4,this is gonna make me sound insufferable but man do I get anxious when I fall behind on the podcasts I regularly listen to,,,,1.23862E+18,https://twitter.com/bryan_cottrill/status/1238624162631032832
3/14/2020 0:30,shawn_coe03,audiewilliaams,0,0,0,that could kill your grandparents if you're not careful lol. that's enough for me to be anxious https://twitter.com/audiewilliaams/status/1238208453140758533 …,,,,1.23862E+18,https://twitter.com/shawn_coe03/status/1238623471741083648
3/14/2020 0:24,JenHijaz,claudinetweets,1,0,10,"Truly. Same. Call me a clinically anxious asthmatic who’s bitter she can’t go to the bars for a month, but I’m really losing patience with friends, family and random strangers who are still in the “business as usual” mindset. There are literally lives/livelihoods at stake.",,,,1.23862E+18,https://twitter.com/JenHijaz/status/1238621877918105602
3/14/2020 0:14,dangerding,GlennonDoyle,1,0,1,<——— anxious bunny https://twitter.com/GlennonDoyle/status/1238449159168053250 …,,,,1.23862E+18,https://twitter.com/dangerding/status/1238619590407663616
3/14/2020 0:12,Betlifesports,,1,15,14,"Everyone be patient. Messages blowing up. I know y’all are anxious to bet something. I am doing mini write ups on each of the 6 games, because I want to be clear I’m not just picking games for fucks sake. There’s a method to my madness. Once you pay, hang tight! Thank you!",,,,1.23862E+18,https://twitter.com/Betlifesports/status/1238619006292000768
3/14/2020 0:11,BarbaraP1958,LittleLeighXoxo,0,0,0,Have some wine . You’ll feel less anxious.,,,,1.23862E+18,https://twitter.com/BarbaraP1958/status/1238618665618214917
3/14/2020 0:07,justicenbd,minnie_mariee,0,0,0,it's making me anxious lol,,,,1.23862E+18,https://twitter.com/justicenbd/status/1238617806058459137
