date,username,to,replies,retweets,favorites,text,geo,mentions,hashtags,id,permalink
7/28/2020 20:47,GamesRedDeer,,27,172,426,PLAY & Let The Fun Begin Like + RT + Click https://www.reddeergames.com Did You see it? pic.twitter.com/45a6EF3ixr,,,,1.28821E+18,https://twitter.com/GamesRedDeer/status/1288214494167158784
3/14/2020 13:59,Damienlewis72,,1,20,123,"Search me, God, and know my heart; test me and know my anxious thoughts. Psalm 139:23",,,,1.23883E+18,https://twitter.com/Damienlewis72/status/1238826998123892736
3/14/2020 13:55,SannyDamet,,1,0,12,"A lot of my peers in music and sports are incredibly anxious, and understandably so. I’m just furious. Absolutely livid. Donald Trump is an absolute ghoul and must be booted from office.",,,,1.23883E+18,https://twitter.com/SannyDamet/status/1238826084361220096
3/14/2020 13:54,Suzie_Taka,,0,0,13,My wife: I think you should stop panic reading the news you’re making yourself anxious Also my wife: PUTS ON 28 DAYS LATER,,,,1.23883E+18,https://twitter.com/Suzie_Taka/status/1238825814482997248
3/14/2020 13:53,AndrewInKenosha,WIbeerbaron,1,0,2,"I work for a food manufacturer. If companies like us stop production, that is the time I'll get anxious.",,,,1.23883E+18,https://twitter.com/AndrewInKenosha/status/1238825549973291008
3/14/2020 13:48,jeremyferrero,,0,0,0,"In times of uncertainty, people can brush things off or get super anxious; but maybe the best response lies in the middle. #reflection #communication #balance #focus #intentionality #LoveMyCampus @Woodway, Texas https://www.instagram.com/p/B9t18ubnmL2/?igshid=jqe6dvao8d82 …",,@Woodway,#reflection #communication #balance #focus #intentionality #LoveMyCampus,1.23882E+18,https://twitter.com/jeremyferrero/status/1238824345113374726
3/14/2020 13:46,DCohenNEWS,ABC13Miya,0,1,5,"Being anxious is no excuse for berating a news crew. There’s a massive gulf between the extremes of panic and complacency. Finding the middle — and delivering factual, cautious and level-headed information — is key. Journalists are working every day to try and accomplish that. https://twitter.com/ABC13Miya/status/1238451602442326016 …",,,,1.23882E+18,https://twitter.com/DCohenNEWS/status/1238823941969453058
3/14/2020 13:46,safranz,NicholsUprising,0,0,1,"Where’s the tired anxious 30-something yelling “first you get a f***ing puppy to bark at all hours & now you’re banging a GD tambourine on the balcony while I’m trying to nap?!!” But also, this is so wholesome https://twitter.com/NicholsUprising/status/1238545438476730369 …",,,,1.23882E+18,https://twitter.com/safranz/status/1238823853679411201
3/14/2020 13:40,mxwllturner,,0,0,4,"Anxious, but sexually compatible",,,,1.23882E+18,https://twitter.com/mxwllturner/status/1238822245079842817
3/14/2020 13:39,paige__phillips,,2,3,14,"Donald McNeil is my biggest crush at the moment. If you’re feeling helpless, scared, and anxious, I suggest listening to The Daily podcast from @nytimespic.twitter.com/Zgl5y3XJ8J",,@nytimespic,,1.23882E+18,https://twitter.com/paige__phillips/status/1238821976103432193
3/14/2020 13:35,sizzlingfajita,,0,0,2,my grumbling stomach's need for food vs. my anxious body's constant foght or flight response,,,,1.23882E+18,https://twitter.com/sizzlingfajita/status/1238821064991551490
3/14/2020 13:34,calwan,NBCSports,0,0,0,"Feeling real anxious these last couple of days and I don’t even know what to do without sports. I know, a little sad, but true. So, just hearing Rebecca Lowe’s voice made it feel a little better and normal. https://twitter.com/NBCSports/status/1238820139791003649 …",,,,1.23882E+18,https://twitter.com/calwan/status/1238820796321222656
3/14/2020 13:32,nicole_iadevaia,,0,0,6,me: anxious AF also me: coffee in bed on a sunny morning - cured,,,,1.23882E+18,https://twitter.com/nicole_iadevaia/status/1238820360944005122
3/14/2020 13:28,ericeidelstein,,1,0,9,anxious!,,,,1.23882E+18,https://twitter.com/ericeidelstein/status/1238819373197885440
3/14/2020 13:27,Max_Mulvihill,,0,0,0,Feeling anxious? Wake up to this playlist. https://open.spotify.com/playlist/3rsC5vxtaNvmKwmiMZlxXe?si=MQ-nVmyNRWSjDi2pEqby0Q …,,,,1.23882E+18,https://twitter.com/Max_Mulvihill/status/1238819164141154305
3/14/2020 13:24,Explorer_Kay,,0,0,0,Is it over yet? #coronavirus feeling anxious about the situation and still very much confused .. is the country on lockdown ?,,,#coronavirus,1.23882E+18,https://twitter.com/Explorer_Kay/status/1238818298931929088
3/14/2020 13:21,Lgo509,,0,0,2,And the anxious one. pic.twitter.com/4RNsNm6u0u,,,,1.23882E+18,https://twitter.com/Lgo509/status/1238817487053033472
3/14/2020 13:08,CaitlinKimmet,,0,0,0,Here’s your daily reminder that being anxious and stressed about COVID-19 isn’t an excuse to be racist.,,,,1.23881E+18,https://twitter.com/CaitlinKimmet/status/1238814369691172865
3/14/2020 13:07,stylebeat,,0,0,0,"Practicing social distancing. Admiring pretty things to avoid being even more anxious. We will get through this, together. : williamlaman @Montecito, California https://www.instagram.com/p/B9txPJ_JAIw/?igshid=171c1yypcrpfz …",,@Montecito,,1.23881E+18,https://twitter.com/stylebeat/status/1238813985308205056
3/14/2020 12:56,marklungo,LanataeLibertas,0,0,0,"It's the Trump era. Everyone's scared and angry and anxious, everyone has something important at stake, and the future is unpredictable.",,,,1.23881E+18,https://twitter.com/marklungo/status/1238811352866729984
3/14/2020 12:45,RockwellMuseum,,0,8,16,"Despite Anxious Times, Museums Offer a “Moment of Zen” on Twitter Follow along! Ommm. #MuseumMomentofZenhttps://hyperallergic.com/547455/despite-anxious-times-museums-offer-a-moment-of-zen-on-twitter/ …",,,#MuseumMomentofZenhttps,1.23881E+18,https://twitter.com/RockwellMuseum/status/1238808478241689600
7/28/2020 20:47,GamesRedDeer,,27,172,426,PLAY & Let The Fun Begin Like + RT + Click https://www.reddeergames.com Did You see it? pic.twitter.com/45a6EF3ixr,,,,1.28821E+18,https://twitter.com/GamesRedDeer/status/1288214494167158784
3/14/2020 12:39,TheBrandonWinn,,0,0,0,Being indecisive makes me anxious,,,,1.23881E+18,https://twitter.com/TheBrandonWinn/status/1238806837044092928
3/14/2020 12:23,RiedyCarl,10percent,0,1,3,"Thank you @danbharris. To all meditators, Be still, Be safe and Offer thoughts of loving kindness to loved ones, all who are sick and anxious and all living beings. Peace and Namaste https://twitter.com/10percent/status/1238591124706639877 …",,@danbharris,,1.2388E+18,https://twitter.com/RiedyCarl/status/1238803058479562759
3/14/2020 12:20,myfilteredview,,0,0,0,I can’t stand antsy behavior anxious people kill my mood and give me anxiety!,,,,1.2388E+18,https://twitter.com/myfilteredview/status/1238802064546897920
3/14/2020 12:18,KSudberry,,0,0,0,Be anxious for nothing.... @Maple Hts City https://www.instagram.com/p/B9troKeAhHFx6fhbRKaXJha7a987p41qpHexvo0/?igshid=oyzcir7z02kn …,,@Maple,,1.2388E+18,https://twitter.com/KSudberry/status/1238801646173339648
3/14/2020 12:15,xenjoyyourslayx,,0,0,1,feeling anxious and I have work soon. ugh.,,,,1.2388E+18,https://twitter.com/xenjoyyourslayx/status/1238800977525948418
3/14/2020 11:42,ih8bleachh,,0,0,2,had a meeting with an amazing video director to work together last night and wasn’t a anxious mess the whole time i’m leveling up babyyyyy,,,,1.23879E+18,https://twitter.com/ih8bleachh/status/1238792491131953152
3/14/2020 11:39,FeministKelly,DonD_bar,1,0,1,It's like we're anxious about something.,,,,1.23879E+18,https://twitter.com/FeministKelly/status/1238791765303459841
3/14/2020 11:25,royckeith,,0,0,0,"When my anxious thoughts multiply within me, Your consolations delight my soul. Psalms 94:19 NASB https://bible.com/bible/100/psa.94.19.NASB …",,,,1.23879E+18,https://twitter.com/royckeith/status/1238788245284102151
3/14/2020 11:16,frjoemaiocco,,0,0,1,"Strengthen your spiritual immunity: ""Don't be anxious, but in everything, by prayer and petition, with thanksgiving, present your requests to God, and the peace of God, which surpasses all understanding, will guard your hearts and minds in Christ Jesus"" Phil 4:6-7.",,,,1.23879E+18,https://twitter.com/frjoemaiocco/status/1238786110874058755
3/14/2020 11:02,_arelio,,0,0,0,Woke up really anxious,,,,1.23878E+18,https://twitter.com/_arelio/status/1238782501394366464
3/14/2020 11:00,DeborahACruz,DeborahACruz,0,0,0,"4. Kids are not freaking out. They know it’s what’s best but they’re not happy. 5. I, on the other hand, can’t turn my brain off and I’m feeling very overwhelmed and anxious ( and that’s not me at all). 6. Favorite horror movie; conjuring is the only one that scared me.",,,,1.23878E+18,https://twitter.com/DeborahACruz/status/1238781955119943683
3/14/2020 10:59,warriormegsie,_Elaine_Murphy,1,0,0,YES!!! Almost every aisle was packed and people running into each other’s carts. Mine got hit. I was starting to get very anxious which has never happened at a grocery store before. ALL the frozen veggies were gone too.,,,,1.23878E+18,https://twitter.com/warriormegsie/status/1238781842452631554
3/14/2020 10:58,BHSstephenson,,1,0,3,In 10 minutes a line has formed and there’s over 50 people. Why am I so anxious?! pic.twitter.com/xUd4X4txOM – at H-E-B plus!,,,,1.23878E+18,https://twitter.com/BHSstephenson/status/1238781629084172289
3/14/2020 10:38,ParraV,Girlsurgeon,0,0,0,"I understand you’re anxious but maybe this is a good time to reflect before we start going after people on social media. Actually, this is always true. Wishing the very best for your patients and for you.",,,,1.23878E+18,https://twitter.com/ParraV/status/1238776554076987392
3/14/2020 10:08,MNiceInvestor,,0,0,0,"I was feeling a little anxious and scared, then I realized that I had 24 cases of toilet paper. And I knew I’d be ok. pic.twitter.com/AR5fGxruv5",,,,1.23877E+18,https://twitter.com/MNiceInvestor/status/1238769027054436352
3/14/2020 8:59,mentally_chill_,,1,1,3,"Man, Steven Universe is getting to the real shit. ""Growing Pains"" really hit me hard. Being exhausted, anxious, and sad just created a combo for a crying spell. #StevenUniverseFuture #StevenUniverse #growingpains #trauma #bpd",,,#StevenUniverseFuture #StevenUniverse #growingpains #trauma #bpd,1.23875E+18,https://twitter.com/mentally_chill_/status/1238751577411702785
3/14/2020 8:49,TONJAleighCLARK,,0,0,0,I am surrounded by lots of anxious people here @quayle_the. I am the one standing in my profile. I ordered an electric wheelchair Monday. I haven't got to use it yet at the Capitol. I am going to sleep now. See y'all in the morning here on twitter,,@quayle_the,,1.23875E+18,https://twitter.com/TONJAleighCLARK/status/1238749080827781121
3/14/2020 8:29,toristuht,,0,1,2,Gonna stop reading about coronavirus for a while I am getting too paranoid and anxious so I might mute the words for a day or two tbh,,,,1.23874E+18,https://twitter.com/toristuht/status/1238744114515984385
3/14/2020 8:06,c8lnp,,0,0,0,i can’t read the news because it makes me feel like the world is gonna end and it makes me so anxious,,,,1.23874E+18,https://twitter.com/c8lnp/status/1238738209733070849
3/14/2020 7:59,xoashhhh_,,0,0,0,"You're not reading this by accident. Everything will be just fine. Breathe and remember that you’ve been in this place before. You've been uncomfortable, anxious, scared, and you survived. So close your eyes and feel the universe within you making a way for you this very moment.",,,,1.23874E+18,https://twitter.com/xoashhhh_/status/1238736604757401600
7/28/2020 20:47,GamesRedDeer,,27,172,426,PLAY & Let The Fun Begin Like + RT + Click https://www.reddeergames.com Did You see it? pic.twitter.com/45a6EF3ixr,,,,1.28821E+18,https://twitter.com/GamesRedDeer/status/1288214494167158784
3/14/2020 7:37,Carol83478741,RealJamesWoods,0,0,0,As I said he speaks and out comes foolish statements. U cannot expect him to be able to think clearly at times and if u question him he becomes anxious and combative.,,,,1.23873E+18,https://twitter.com/Carol83478741/status/1238731082880688128
3/14/2020 7:25,iSpeakGuapanese,,0,0,1,I literally use to be anxious for the next school day cause we aint have lights most of the time & if we had lights we def aint have food,,,,1.23873E+18,https://twitter.com/iSpeakGuapanese/status/1238727946497646592
3/14/2020 7:10,copperpaint,,1,1,4,too anxious to live too anxious to d*e,,,,1.23872E+18,https://twitter.com/copperpaint/status/1238724050513362944
3/14/2020 7:03,gingerxsnap_,,1,1,1,"Insomnia is driving me absolutely crazy, but I just found the most feel good show on Netflix I think! If you’re feeling anxious or sad about life, watch Kitten Rescuers-it’s so damn heartwarming!!",,,,1.23872E+18,https://twitter.com/gingerxsnap_/status/1238722298158473216
3/14/2020 6:48,JorJorBinkzzz,nenagerman,0,0,5,"This upheaval of my routine and plan for the month and the panic surrounding corona has me anxious as all hell. So if you’re working from home for the first time and having a hard time adjusting like me, try sticking to a schedule like this!! https://twitter.com/nenagerman/status/1238607572174848006 …",,,,1.23872E+18,https://twitter.com/JorJorBinkzzz/status/1238718638603018241
3/14/2020 6:14,Latamalera11,MillennialMe88,1,0,1,I was anxious earlier and I figured out it was because I don't know when I'll be able to get my toddler wipes... FUCKING WIPES,,,,1.23871E+18,https://twitter.com/Latamalera11/status/1238710002153472003
3/14/2020 5:36,SofiaAngelinaa,,0,0,3,"i was so anxious on the plane and my momma sat next to me and we listened to ‘no place’ and ‘breathe’ from bsb :,)",,,,1.2387E+18,https://twitter.com/SofiaAngelinaa/status/1238700402817880064
3/14/2020 5:35,Rischa,,1,0,6,"How cute are my son’s dog and my mom’s?! This is Bart and Della. I hate that these shots aren’t composed better, but I was so anxious to get the photos before they ran off again. We were hiking my parents’ property and they were excited. pic.twitter.com/NwJqliquNT",,,,1.2387E+18,https://twitter.com/Rischa/status/1238700269317357568
3/14/2020 5:27,janesilva760,,0,0,0,Simple Metacognitive Strategies to Help Anxious Learners Succeed https://www.edutopia.org/article/simple-metacognitive-strategies-help-anxious-learners-succeed …,,,,1.2387E+18,https://twitter.com/janesilva760/status/1238698243946512384
3/14/2020 5:12,MylifeasJade,,1,0,1,I’m a member on a few Bay Area mom groups on FB and they’re talking about stocking up because of this virus and it’s making me incredibly anxious.... like do I stock up my kitchen?! Do i not?! Is food going to run out? I. DON’T. KNOW.,,,,1.23869E+18,https://twitter.com/MylifeasJade/status/1238694515050860544
3/14/2020 5:08,y0cie_doodles,blainoart,0,0,1,Hahah tysm! I think it’s becuz I drew in so many styles before and the fact I can’t leave things too long on a wip phase haha I get anxious when I leave things halfway for too long,,,,1.23869E+18,https://twitter.com/y0cie_doodles/status/1238693535588724736
3/14/2020 5:08,TheAuthorGuy,,61,13,284,You anxious? Me either.,,,,1.23869E+18,https://twitter.com/TheAuthorGuy/status/1238693534183481344
3/14/2020 4:58,AdnanCodes,BlakeMcClary,0,0,0,"GDPR for sure. I was like I get it and let’s move on. COVID19, This is serious and the same time; let’s be cautious and not anxious.",,,,1.23869E+18,https://twitter.com/AdnanCodes/status/1238690940379901957
3/14/2020 4:56,CoronaHSCounsel,NAMICommunicate,0,4,3,"The #COVID19 outbreak is leaving many feeling anxious, angry, sad, or scared. If you need to talk to someone, text NAMI to 741741 or call the NAMI Helpline at 1-800-950-NAMI (6264). https://twitter.com/NAMICommunicate/status/1238528260440567808 …",,,#COVID19,1.23869E+18,https://twitter.com/CoronaHSCounsel/status/1238690389512445952
3/14/2020 4:47,kaylahohorst,,0,0,2,I am entirely too anxious to go to bed right now and I’m stressed as fuck,,,,1.23869E+18,https://twitter.com/kaylahohorst/status/1238688083194888192
3/14/2020 4:45,SageHillfarms,,1,0,9,Can I sleep while feeling this anxious? Suppose I won't know til I try.,,,,1.23869E+18,https://twitter.com/SageHillfarms/status/1238687572005511168
3/14/2020 4:41,donniecopeland,,0,0,0,"Dear @EthanDolan Be anxious for nothing, but in everything by prayer and supplication, with thanksgiving, let your requests be made known to God; Philippians 4:6",,@EthanDolan,,1.23869E+18,https://twitter.com/donniecopeland/status/1238686579696205826
3/14/2020 4:40,jpalmerdubs,tropicofdan,0,0,3,The stores will get stocked. It’s ok to be anxious. This is new for all of us.,,,,1.23869E+18,https://twitter.com/jpalmerdubs/status/1238686505616334848
3/14/2020 4:40,stacy_ellen_,audreysl0ve,0,0,1,Also I did the hold your breath test and passed with flying colors. All the news everywhere is making me super anxious about everything.,,,,1.23869E+18,https://twitter.com/stacy_ellen_/status/1238686473622147074
3/14/2020 4:39,FaithLBoles,,0,0,5,This whole coronavirus situation has got me stressed and anxious. I’m really thankful that I planned to go home before all of this started happening. I need be around my parents and my Savannah friends right now.,,,,1.23869E+18,https://twitter.com/FaithLBoles/status/1238686275978309632
7/28/2020 20:47,GamesRedDeer,,27,172,426,PLAY & Let The Fun Begin Like + RT + Click https://www.reddeergames.com Did You see it? pic.twitter.com/45a6EF3ixr,,,,1.28821E+18,https://twitter.com/GamesRedDeer/status/1288214494167158784
3/14/2020 4:33,filmgirl21,ShineText,0,0,0,RT; helpful for those naturally anxious ppl (like moi) deal the #coronavirus #Covid_19 fears in any type anxiety & levels 4 our healthhttps://twitter.com/ShineText/status/1238423316060426241 …,,,#coronavirus #Covid_19,1.23868E+18,https://twitter.com/filmgirl21/status/1238684566031945729
3/14/2020 4:22,afrosypaella,,1,0,0,"How my anxious brain works—thinking back to how I was in Milan, Bologna & Rome in early January and wondering if back then I was exposed to the very early stirrings of this virus without even knowing it.",,,,1.23868E+18,https://twitter.com/afrosypaella/status/1238681956218556417
3/14/2020 4:22,21sadbitch,,0,0,0,May be Just me but I get anxious about showing people my altar or taking pictures of it etc. just something about protecting my energy.,,,,1.23868E+18,https://twitter.com/21sadbitch/status/1238681925977403392
3/14/2020 4:17,melaniegrrace,,0,0,5,my anxiety is sky high w everything going on rn. and even tho i'm fine and i know i'm ok. everything around me is DEFINITELY NOT. so im anxious and feeling sick constantly because this situation wont go away.,,,,1.23868E+18,https://twitter.com/melaniegrrace/status/1238680667875090432
3/14/2020 4:17,Alazaybae,,0,1,3,Anxious asf to see @OfficialWebbie tonight !,,@OfficialWebbie,,1.23868E+18,https://twitter.com/Alazaybae/status/1238680623541374977
3/14/2020 4:14,Bells_of_NYC,hankgreen,1,0,5,"please play untitled goose game. i know it’s not big anymore, but i think it would be fun to watch you play. very lighthearted for this anxious time.",,,,1.23868E+18,https://twitter.com/Bells_of_NYC/status/1238679882303000576
3/14/2020 4:11,heidiMphoto,caitrionambalfe,0,0,0,Anxious over all this or taking it in stride?,,,,1.23868E+18,https://twitter.com/heidiMphoto/status/1238679005966073864
3/14/2020 4:02,VegasIntrovert,SinCityNerds,2,0,4,"So in true degenerate fashion and as an anxious flyer, I make bets in my head about how long the turbulence will last. If I ""win"" I give myself some sort of landing prize like a trashy slushy drink. I hope reading that at least distracted you awhile",,,,1.23868E+18,https://twitter.com/VegasIntrovert/status/1238676833723469826
3/14/2020 3:57,JettiWhitewolf,Wewillrocku66,1,0,1,"Ello, The Troops are anxious this isn't good religion and conspiracy are main topics I see the writing on the wall wish all did, if I'm away don't worry I'm on base may have to roll the sleeves up n help out as for now its standard Ops. Be safe stay healthy.",,,,1.23868E+18,https://twitter.com/JettiWhitewolf/status/1238675684060303360
3/14/2020 3:55,OJIBAJO,AmyFlyn93730647,2,0,4,"I feel like super depressed and anxious because of all of this. I’m even MORE worried about bills, and I feel even more isolated than I already did. My sons championship hockey game (senior year) was canceled. I’m heartbroken. I took off from work for it too. This all just sucks!",,,,1.23868E+18,https://twitter.com/OJIBAJO/status/1238675020559327232
3/14/2020 3:43,crazyintherain,,0,1,6,How are you feeling about the Coronavirus? I feel a bit anxious and unsure if I want to be in LA where I just moved or in NYC where I have more friends and would be closer to my family in Maine @Venice Beach https://www.instagram.com/p/B9swwioFJk0/?igshid=9ggh2n3ro6bn …,,@Venice,,1.23867E+18,https://twitter.com/crazyintherain/status/1238672193632055298
3/14/2020 3:37,ty_quinte,,0,0,0,I’m real anxious rn .... i can’t,,,,1.23867E+18,https://twitter.com/ty_quinte/status/1238670443369902080
3/14/2020 3:30,WoofOnTheHoof,,0,0,0,The Democrats are anxious to get President Trump to cancel rallies. But in truth the rallies are less necessary than in the early days because his supporters have gone digital. We are very active in the digital sphere. @realDonaldTrump,,@realDonaldTrump,,1.23867E+18,https://twitter.com/WoofOnTheHoof/status/1238668900264534023
3/14/2020 3:30,Marinadelrey_x,,0,0,0,I probably won’t be on this bird app that much because I’m over the virus tweets and honestly it makes me more worried and anxious.,,,,1.23867E+18,https://twitter.com/Marinadelrey_x/status/1238668677454716929
3/14/2020 3:25,emilyereed,,0,0,0,Some social workers are just not ok. I am so anxious and worried for my students. Hoping for peace.,,,,1.23867E+18,https://twitter.com/emilyereed/status/1238667462759133184
3/14/2020 3:22,kanaruhalter,,0,0,6,super cool how staying in and avoiding the public is what i already do anyways but now i’m just more anxious LOL(:,,,,1.23867E+18,https://twitter.com/kanaruhalter/status/1238666807554093057
3/14/2020 3:16,Admirallyndsey,,0,0,2,i’ve done nothing for the past two hours but dance in my bathroom mirror as if i’m in the club. living my best life. it’s so small but it was the 2 hours of pure happiness where i felt so good & not stressed or anxious like the past 3 months. i love that for me,,,,1.23867E+18,https://twitter.com/Admirallyndsey/status/1238665284640260096
3/14/2020 3:14,ellebasi_noxim,,0,0,9,"I feel like human garbage I ate so much food today But also I haven’t eaten this much food in like 2 weeeks I def stress ate and now I feel like the grossest human ever, and I still feel anxious",,,,1.23866E+18,https://twitter.com/ellebasi_noxim/status/1238664657822527489
3/14/2020 3:13,PEMTweets,,2,14,17,We don’t have the ability to readily test for coronavirus - SARS-CoV-2 in the ED yet in the US. Please share and help explain this to anxious patients and families #coronavirus #Covid_19 #COVID19 #foamed,,,#coronavirus #Covid_19 #COVID19 #foamed,1.23866E+18,https://twitter.com/PEMTweets/status/1238664569964441600
3/14/2020 3:12,Alba_MesCuDi,,0,0,0,I finished how to get away with murder now I’m anxious for April to see the finale,,,,1.23866E+18,https://twitter.com/Alba_MesCuDi/status/1238664205303242752
7/28/2020 20:47,GamesRedDeer,,27,172,426,PLAY & Let The Fun Begin Like + RT + Click https://www.reddeergames.com Did You see it? pic.twitter.com/45a6EF3ixr,,,,1.28821E+18,https://twitter.com/GamesRedDeer/status/1288214494167158784
3/14/2020 3:09,MABACTS,,0,0,1,"Anxious, depressed, and lonely. You?",,,,1.23866E+18,https://twitter.com/MABACTS/status/1238663445379198976
3/14/2020 3:04,allysigurdson,,0,0,6,I made the mistake of watching I Am Legend and accidentally made myself anxious OOPS.,,,,1.23866E+18,https://twitter.com/allysigurdson/status/1238662345523527680
3/14/2020 3:03,DaRkDaN89,,0,0,0,"No work to do, so rather than sit being anxious indoors we got outside to enjoy the city! pic.twitter.com/EIAWmFQLYe",,,,1.23866E+18,https://twitter.com/DaRkDaN89/status/1238662011170328576
3/14/2020 2:51,jackhaynie,MsMelChen,2,0,2,"This game at literally exactly the right time, if you feel like you’re getting anxious get off this hellsite please https://twitter.com/MsMelChen/status/1238642293059584004 …",,,,1.23866E+18,https://twitter.com/jackhaynie/status/1238658956219777024
3/14/2020 2:50,chloeraineee17,,0,0,1,"if you're stressing and anxious about everything going on, @NiallOfficial's new album will help you relax i promisepic.twitter.com/4asxV84Coj",,@NiallOfficial,,1.23866E+18,https://twitter.com/chloeraineee17/status/1238658620906143747
3/14/2020 2:47,mrlees_vhs,,1,5,22,"Students- I know this is a confusing, anxious time for a lot of you right now. Please know that I am here for you if you need anything. Help with homework, Food or supplies, someone to vent to. I got you. pic.twitter.com/MIcWL4xBEx",,,,1.23866E+18,https://twitter.com/mrlees_vhs/status/1238657997888339970
3/14/2020 2:45,toozurnt,,0,0,2,Alright gonna try to get off social media for the night it’s getting me too anxious even though it’s all so funny xx,,,,1.23866E+18,https://twitter.com/toozurnt/status/1238657414708097025
3/14/2020 2:43,marissa_cc,,0,0,0,If for no other reason I’m staying home cause there’s nothing worse than being around anxious Americans at Costco. Everyone screaming and panicking I can’t handle all that.,,,,1.23866E+18,https://twitter.com/marissa_cc/status/1238656896376156163
3/14/2020 2:40,MalcTheTre,,0,0,2,I’m so tired I’m feeling anxious.,,,,1.23866E+18,https://twitter.com/MalcTheTre/status/1238656236029165571
3/14/2020 2:39,woosignimom,,1,0,10,"And be kind to your staff and colleagues who are immunocompromised or anxious or vulnerable. They may be struggling and you’re not aware and also have kids, parents, friends who might be struggling.",,,,1.23866E+18,https://twitter.com/woosignimom/status/1238655878204719105
