date,username,to,replies,retweets,favorites,text,geo,mentions,hashtags,id,permalink
3/14/2020 18:17,CiriAntares,,2,0,20,"At the vets with Pepsi getting him his heartworm injection, nails trim, & a couple tests. Poir dog is so anxious they had to give him meds to calm him down. That & his nose is running. I'll have to take him for one of his favorite treats afterward. A plain Wendy's hamburger",,,,1.23889E+18,https://twitter.com/CiriAntares/status/1238891910506450944
3/14/2020 18:08,joshksanders,hankrsmith,0,0,2,Create a playlist specifically for when you feel anxious so you have a “go-to”,,,,1.23889E+18,https://twitter.com/joshksanders/status/1238889721733902336
3/14/2020 18:06,LandofLincoln39,michaelpisto1,1,0,3,I wish I could turn it off mike. I can’t help but get anxious at every turn. I’m trying so hard to calm myself,,,,1.23889E+18,https://twitter.com/LandofLincoln39/status/1238889377142640642
3/14/2020 18:03,Myennnn,,1,0,2,i KNOW how this video ends every mf time but i still get so anxious watching it (ignore my yelling. i think at this point we all know imma loud ass ho ) pic.twitter.com/mLheYe0XiX,,,,1.23889E+18,https://twitter.com/Myennnn/status/1238888525652570113
3/14/2020 18:01,ortiz_ubaldo,,0,0,11,Yes! I do deep clean when I’m hella anxious and stressed,,,,1.23889E+18,https://twitter.com/ortiz_ubaldo/status/1238887986323849216
3/14/2020 17:52,hahabirdpumpkin,alansamerica,0,0,0,I was getting nervous about it til I got to thinking about things. My friend from high school died from the flu back in 2013. Any flu kills thousands every year. Every year the young and old are told to get a flu shot. What's making me more anxious is all the fuss over...,,,,1.23889E+18,https://twitter.com/hahabirdpumpkin/status/1238885842808180738
3/14/2020 17:49,Sarah_Helenn,,2,0,5,For 18 years my mother told me to make my bed in the morning... never did. Now I get anxious if I don’t make it right away after getting up.,,,,1.23889E+18,https://twitter.com/Sarah_Helenn/status/1238885048058814464
3/14/2020 17:49,ValerieMgrtAnne,dcolonizehockey,0,0,1,"Same. I'm sensitive to the panicked atmosphere so even though I actually don't need anything right now, I'm fighting with the part of my brain that's telling me I NEED to go buy beans. Anxious either way but more comfortable at home so my anxiety has pillows.",,,,1.23889E+18,https://twitter.com/ValerieMgrtAnne/status/1238885023966728193
3/14/2020 17:43,ChiefRedWolff,,4,0,29,My girlfriend is undergoing her cancer treatments and while it’s an immunotherapy and not chemo so she’s not completely immunocompromised I still feel like an anxious suit of nervous energy being gone for a week with the current state of chaos.,,,,1.23888E+18,https://twitter.com/ChiefRedWolff/status/1238883426029240321
3/14/2020 17:41,AliLevineDesign,,0,2,18,Messy hair don’t care!! ameliareijacaruso Happy Saturday loves!! Here’s some sunshine and smiles for all those feeling overwhelmed and anxious!! We are all in this together and I’m here for you so are… https://www.instagram.com/p/B9uPB2sp5Ml/?igshid=16idcs9bwn8kl …,,,,1.23888E+18,https://twitter.com/AliLevineDesign/status/1238883046289485826
3/14/2020 17:37,renedugar,moryan,0,0,1,"My anxious friends, a good thread. https://twitter.com/moryan/status/1238875469400997888 …",,,,1.23888E+18,https://twitter.com/renedugar/status/1238881874380042244
3/14/2020 17:35,mirandaa_bands,,0,0,1,"corona virus ain’t got shit on me, yet I’m still mad anxious about getting it",,,,1.23888E+18,https://twitter.com/mirandaa_bands/status/1238881553024978949
3/14/2020 17:34,Bens_head_space,CrisisTextLine,0,0,2,"It’s a weird time right now...if you’re feeling anxious, worried, or scared...I’m pretty sure you’re not the only one. This tweet seems like it could be helpful/useful. https://twitter.com/CrisisTextLine/status/1238536740140449793 …",,,,1.23888E+18,https://twitter.com/Bens_head_space/status/1238881130545205250
3/14/2020 17:33,kerrydho,jcourtsull,0,0,0,Take this seriously. Don’t panic. Don’t be anxious. Just be smart. Trust in a sovereign God. But please stop making it into “just another flu”. #COVID19https://twitter.com/jcourtsull/status/1238660054812954624 …,,,#COVID19https,1.23888E+18,https://twitter.com/kerrydho/status/1238881069543428096
3/14/2020 17:33,becausejami,,0,1,3,The Anxious Hands of New York’s Subway Riders in the Face of Coronavirus https://www.newyorker.com/culture/photo-booth/the-anxious-hands-of-new-yorks-subway-riders-in-the-face-of-the-coronavirus … via @NewYorker,,@NewYorker,,1.23888E+18,https://twitter.com/becausejami/status/1238880912030552065
3/14/2020 17:30,e_thecounselor,,0,0,0,Is this Pandemic stressing you out and making you anxious? Did you know you can still see your counselor while this Coronavirus is looming? Telehealth is a option that allows you to have your session via the… https://www.instagram.com/p/B9uPT7Ml01-/?igshid=eb2wenmxwact …,,,,1.23888E+18,https://twitter.com/e_thecounselor/status/1238880117658615808
3/14/2020 17:28,brigdoingbrig,,1,0,4,Some of these require resources you may not have but what’s free is spreading positivity and laughter when you can. Check on friends and loved ones - we’re ALL feeling anxious but your moment of strength/happiness can help a friend who might be at a point of their worst anxiety,,,,1.23888E+18,https://twitter.com/brigdoingbrig/status/1238879774782652416
3/14/2020 17:27,LindsayLVNV,,1,0,0,A good use of time during this anxious moment in our lives is to make a list of companies that our doing the right thing for their employees. I’m going to use my list to support these businesses moving forward. The power of the dollar! #dogoodthings #COVIDー19,,,#dogoodthings #COVIDー19,1.23888E+18,https://twitter.com/LindsayLVNV/status/1238879469818929152
3/14/2020 17:20,Mobebear,realDonaldTrump,0,0,0,I would think Americans would feel less anxious if YOU were the person we see heading up the task force instead of VP Pence. #CoronaVirusUpdates #MaralagoVirus #TrumpVirus,,,#CoronaVirusUpdates #MaralagoVirus #TrumpVirus,1.23888E+18,https://twitter.com/Mobebear/status/1238877578330431488
7/28/2020 20:47,GamesRedDeer,,27,172,426,PLAY & Let The Fun Begin Like + RT + Click https://www.reddeergames.com Did You see it? pic.twitter.com/45a6EF3ixr,,,,1.28821E+18,https://twitter.com/GamesRedDeer/status/1288214494167158784
3/14/2020 17:16,kelleyoneill22,,1,0,0,Standing in line waiting to eat breakfast. And this girl in line decides to tell her other friends about this girl she knows being in the hospital with “a virus”..... excuse me..... I have never been so anxious. #CoronavirusPandemic,,,#CoronavirusPandemic,1.23888E+18,https://twitter.com/kelleyoneill22/status/1238876597597409285
3/14/2020 17:14,JudithS81194112,,0,0,0,"This Sunday has been declared #NationalDayofPrayer. Verses About Prayer — walk in love. Philippians 4:6 ""Do not be anxious about anything, but in everything, by prayer and petition, with thanksgiving, present your requests to God."" pic.twitter.com/tQRs8delCX",,,#NationalDayofPrayer,1.23888E+18,https://twitter.com/JudithS81194112/status/1238876068083367937
3/14/2020 17:12,zarizahra,zfrmrza,0,0,3,Finally! Relieved to see Pakistan is taking action... was watching the packed crowds at PSL games this week and getting anxious. For context: multigenerational households are the norm in PK. So are diabetes and hypertension. Keep our elderly safe. @MeezanZahra @AliFaatehKhwajahttps://twitter.com/zfrmrza/status/1238576071974453248 …,,@MeezanZahra @AliFaatehKhwajahttps,,1.23888E+18,https://twitter.com/zarizahra/status/1238875579136405504
3/14/2020 17:10,KerryLynS130,,3,0,4,All of this coronavirus stuff and then finding out that I won’t be at work for 2 weeks when my students have shown major progress and now that’s halted. I know it’s necessary to contain the virus but it has me anxious that I can’t allow myself to enjoy my weekend.,,,,1.23888E+18,https://twitter.com/KerryLynS130/status/1238875035483410436
3/14/2020 17:09,porter_debby,igorbobic,1,0,15,A nation turns its anxious eyes to Rand Paul's neighbor.,,,,1.23887E+18,https://twitter.com/porter_debby/status/1238874892503785475
3/14/2020 17:04,DeWayneHamby,,2,1,8,"Don’t belittle someone for not responding to a crisis (or perceived crisis) in exactly the same manner you do. Don’t make them feel small for being afraid when you’re not or anxious when you’re confident. The danger may not be real, but it’s real to them.",,,,1.23887E+18,https://twitter.com/DeWayneHamby/status/1238873743390212096
3/14/2020 16:57,4thTriBodies,,0,0,0,"How are y’all holding up?! We are anxious but trying to make the most of a month of cancelled schools, and work, and travel. - I wanted to share that I’ve had a couple repeat clients reach out to ask if they can book… https://www.instagram.com/p/B9uLlfujMpu/?igshid=y6w879koc6u8 …",,,,1.23887E+18,https://twitter.com/4thTriBodies/status/1238871935099887621
3/14/2020 16:57,BossofMario,TiffanyDCross,0,0,0,"Sometimes anxious, sometimes fuck it",,,,1.23887E+18,https://twitter.com/BossofMario/status/1238871827134513152
3/14/2020 16:55,JasonCusterPhD,,2,0,19,"So.... I think I'm going to make a point of not tweeting about anything involving the world being on fire. Do and share what you want and need to, but it's a bit overwhelming for anxious people like myself. Instead of just disappearing, I'll try to do more shitposting on here.",,,,1.23887E+18,https://twitter.com/JasonCusterPhD/status/1238871300740956161
3/14/2020 16:47,LaurieAEakes,amergina,0,0,2,Cyber hugs. My therapist said her whole schedule is full anxiety patients right now. Especially those of us who have lowered immune system's for chronic illness reasons. It's just an anxious time and we're all here for one another or should be.,,,,1.23887E+18,https://twitter.com/LaurieAEakes/status/1238869491414708225
3/14/2020 16:44,_Taurean,,0,0,0,"I promise you, despite what you think, enforcing a cameras on policy for remote workers isn’t as beneficial as you think it is. Please let people decide on what they’re comfortable with, don’t add another thing for someone to be anxious about.",,,,1.23887E+18,https://twitter.com/_Taurean/status/1238868702822453248
3/14/2020 16:42,scottleggs,GoMoGreene,0,0,0,When I’m anxious I like to have my feet covered!!! Don’t judge me!,,,,1.23887E+18,https://twitter.com/scottleggs/status/1238868160633135104
3/14/2020 16:41,MacNicolSparkle,realmallard1,0,0,1,Please keep us up to date on how you both are doing. I have no doubt that you are very anxious right now. I send all my energy and faith to you both.,,,,1.23887E+18,https://twitter.com/MacNicolSparkle/status/1238867791039602688
3/14/2020 16:33,holachieri,,0,0,1,"This string of events have me feeling like.....I was this close to carrying the virus and bringing it home, putting my 60+ mom at risk. I feel...so lucky and so freaking anxious. Wishing a speedy recovery to everyone affected",,,,1.23887E+18,https://twitter.com/holachieri/status/1238865928533635072
3/14/2020 16:31,xojjayyy_,,0,2,7,"I AM NOT OBLIGATED TO DO ANYTHING I don’t want to If I’m stressing out and anxious about something before I even leave my house, you don’t get to get mad at me canceling plans. My mental health is more important than our plans we made... sorry",,,,1.23887E+18,https://twitter.com/xojjayyy_/status/1238865292341710851
3/14/2020 16:31,CMuzyk,KellyO,0,0,0,Thank you Kelly! You are on fire. We appreciate your hard work. We are anxious and you are pressing to get the info we need.,,,,1.23887E+18,https://twitter.com/CMuzyk/status/1238865260980965376
3/14/2020 16:28,nayyyifa,Saisailu97,1,0,5,The constant struggle between wanting to check up on family back home and not wanting to get anxious about everything happening around the world https://twitter.com/Saisailu97/status/1238847018157535232 …,,,,1.23886E+18,https://twitter.com/nayyyifa/status/1238864564961325056
3/14/2020 16:27,AlexandraLong,,1,1,10,"No WiFi, lots of great VHS tapes, and plenty of land for our puppy to run around off-leash. Exactly the ungluing from the news that we needed right now. Still very aware, still pretty anxious, but it’s been the perfect way to pause and appreciate each other in nature. pic.twitter.com/fSGf5aSrlU – at Marshall, VA",,,,1.23886E+18,https://twitter.com/AlexandraLong/status/1238864327966437379
3/14/2020 16:27,WorldAffairsPro,,1,1,2,No reduction in bluster from #POTUS. Taking victory lap before re-assuring extremely anxious public about #coronavirus panic. “The American public has been incredible.” #COVID19pic.twitter.com/SvVfc5MC8A,,,#POTUS #coronavirus #COVID19pic,1.23886E+18,https://twitter.com/WorldAffairsPro/status/1238864295707979776
3/14/2020 16:23,heathervmyers,,5,1,7,"Hello! Beyond other things, I am desperately anxious about income for the summer. Does anyone have any good teaching leads around the Denton area, or especially online? I have 3 summer semester experience of online teaching Engl comp. 101 & 102. (continued)",,,,1.23886E+18,https://twitter.com/heathervmyers/status/1238863319261421576
7/28/2020 20:47,GamesRedDeer,,27,172,426,PLAY & Let The Fun Begin Like + RT + Click https://www.reddeergames.com Did You see it? pic.twitter.com/45a6EF3ixr,,,,1.28821E+18,https://twitter.com/GamesRedDeer/status/1288214494167158784
3/14/2020 16:19,TheODDSock1,,0,0,1,"When my anxious thoughts multiply within me, Your comforts delight me. Psalms 94:19 AMP https://bible.com/bible/1588/psa.94.19.AMP …",,,,1.23886E+18,https://twitter.com/TheODDSock1/status/1238862216474046464
3/14/2020 16:16,kristinbeckman,,0,0,0,I know he’s not a real doctor but @RugDoctor is giving me great relief during this anxious time. #BlackFriday2017 #coronavirus Start at 1:30 https://youtu.be/lG6bPwwz3iQ via @YouTube,,@RugDoctor @YouTube,#BlackFriday2017 #coronavirus,1.23886E+18,https://twitter.com/kristinbeckman/status/1238861493095018503
3/14/2020 16:15,GetItBigGurl,erikhinton,0,0,1,America only cares about predatory capitalism when it makes upper middle class white people feel anxious... https://twitter.com/erikhinton/status/1238826118721024000 …,,,,1.23886E+18,https://twitter.com/GetItBigGurl/status/1238861338958495744
3/14/2020 16:15,Sen_Gounardes,,2,1,8,"I know many people are feeling anxious, scared, and even confused. It’s ok if you are too. Despite all that, your commitment and dedication to serving the public in any possible way is beyond appreciated and valued. We see you and we’re here for you. We’re in this together.",,,,1.23886E+18,https://twitter.com/Sen_Gounardes/status/1238861222084313095
3/14/2020 16:14,KaceyMHill,,0,0,0,"There's a lot of anxious people out there right now who rely on blood donations to survive. I know times are scary, but if you can donate, now is the time to literally be a lifesaver! https://abcnews.go.com/Politics/fda-worried-blood-shortage-donation-drives-canceled-amid/story?id=69581026 …",,,,1.23886E+18,https://twitter.com/KaceyMHill/status/1238861002940321793
3/14/2020 16:12,alya_zayed,,0,0,1,"Weirdly, it's only taken me til today to be anxious about coronavirus.",,,,1.23886E+18,https://twitter.com/alya_zayed/status/1238860645111664640
3/14/2020 16:10,LeishaRiddel,studioanisa,0,0,0,Become an anxious germaphobe! You’ll never have an untidy house again!,,,,1.23886E+18,https://twitter.com/LeishaRiddel/status/1238860125684801540
3/14/2020 16:10,victoriagraupp,,2,0,3,"Very sad that my usual ""I'm anxious and need out of the house and I have both kids and it's rainy"" destination, Target, is likely not a calming place for me to be right now",,,,1.23886E+18,https://twitter.com/victoriagraupp/status/1238860078347927552
3/14/2020 16:05,avalonstar,,3,0,58,Gonna practice some “social media distancing”. Love ya friends. Stay alert and not anxious. pic.twitter.com/bg9O12hlnI,,,,1.23886E+18,https://twitter.com/avalonstar/status/1238858890286006273
3/14/2020 16:03,DJRiffRaff,,0,0,0,"@SpeakerPelosi Don’t get me wrong, I admire you, I respect you and I wish you were running our country right now....but just a suggestion; shouldn’t you suspend your email campaign to win swag and to donate to your campaign? People are hurting, they’re anxious, and we’re broke!",,@SpeakerPelosi,,1.23886E+18,https://twitter.com/DJRiffRaff/status/1238858324415631360
3/14/2020 15:56,ajapplebey,,0,0,77,how sweet this quarantine would be as a 30 y/o independent lady relaxing in a studio apartment with her partner of four years instead of a 22 y/o anxious college senior living in a co-op of 18 ppl having real issue self-isolating!,,,,1.23886E+18,https://twitter.com/ajapplebey/status/1238856657674911749
3/14/2020 15:55,FaithfullyBP,middlechurch,1,2,9,"It’s been a long week. And I’ll be honest: I’m scared. I’m anxious about so many people I love, and deeply concerned about the coming weeks. I’m so glad to gather with queer Middle folks tomorrow, to feelings in community. To any LGBTQ people reading this: Please, join us. https://twitter.com/middlechurch/status/1238854909673517056 …",,,,1.23886E+18,https://twitter.com/FaithfullyBP/status/1238856242916921344
3/14/2020 15:42,muddy_soul,,0,0,5,last night i was so excited to see my friends today and now i feel anxious about everything and i just want to go home to cook food and embroider with my son and never go outside,,,,1.23885E+18,https://twitter.com/muddy_soul/status/1238852894163521536
3/14/2020 15:21,spokenberb,samhsagov,0,0,0,Self isolating can be... isolating. These are anxious and confusing times. Support is just a phone call away. https://twitter.com/samhsagov/status/1238842823241281537 …,,,,1.23885E+18,https://twitter.com/spokenberb/status/1238847686419156992
3/14/2020 15:18,BigBooyaw,,0,0,0,#prayer #prayerwarrior #prayerworks #prayers #prayerchangesthings #anxious #anxiety #anxiousthoughts #anxiousfornothing #believe #live #liveyourbestlife #liveasyouthink #kindhearted… https://www.instagram.com/p/B9uAOoCJCxgooZGeTMc1tU6rGTw091LGEKfoZw0/?igshid=ebq2uwntc9cq …,,,#prayer #prayerwarrior #prayerworks #prayers #prayerchangesthings #anxious #anxiety #anxiousthoughts #anxiousfornothing #believe #live #liveyourbestlife #liveasyouthink #kindhearted,1.23885E+18,https://twitter.com/BigBooyaw/status/1238846960603455488
3/14/2020 15:16,FultonNursingEd,,0,0,5,"When I am afraid, anxious, or unsure, I take a lot of comfort in remembering this. #stillonthethronepic.twitter.com/WjFlpUq66T",,,#stillonthethronepic,1.23885E+18,https://twitter.com/FultonNursingEd/status/1238846499393503233
3/14/2020 15:15,gplewis,,0,0,0,"Maybe doing something new: writing my ideas about what I read. Oh well, old tweets were perfect but now they’re falling out of view. When anxious about money and identity, do a bunch of stuff you’ve never done before. I’m giving you the advice as I test it; there are worse men",,,,1.23885E+18,https://twitter.com/gplewis/status/1238846111692943361
3/14/2020 15:14,mlbarton1969,,1,5,30,"Sunrise today @7:27 am Today, my husband & I celebrate our 27th wedding anniversary. 27 yrs ago was #TheBlizzardof1993 #StormoftheCentury So much tumult, uncertainty, and anxious times in our world today. But the sun still came up... @spann @NC5_BreeSmith @WSMVLisaSpencerpic.twitter.com/jxqdizKaqI",,@7 @spann @NC5_BreeSmith @WSMVLisaSpencerpic,#TheBlizzardof1993 #StormoftheCentury,1.23885E+18,https://twitter.com/mlbarton1969/status/1238846089941442564
3/14/2020 15:11,kevinarigold,,0,0,0,"I’m stressed, anxious the last three days since this whole stoppage on all events greater than 200+ ppl.. I’m just laying it out there.. sharing opinions,I’m just sure I try! Healthy ppl & projects in film =political care backache, this time on a world health stage. Thanks @WHO",,@WHO,,1.23885E+18,https://twitter.com/kevinarigold/status/1238845264548380674
3/14/2020 15:06,kinny55kuppetz,,0,0,4,IM SO FXCKING ANXIOUS!,,,,1.23884E+18,https://twitter.com/kinny55kuppetz/status/1238844075169595393
7/28/2020 20:47,GamesRedDeer,,27,172,426,PLAY & Let The Fun Begin Like + RT + Click https://www.reddeergames.com Did You see it? pic.twitter.com/45a6EF3ixr,,,,1.28821E+18,https://twitter.com/GamesRedDeer/status/1288214494167158784
3/14/2020 15:05,KrewWhs,,0,9,16,Local Kindness Krew & Wickliffe Students: what a wonderful idea for those who are feeling extra lonely and anxious right now. Please send your notes to kadams@wickliffeschools.com & I will personally mail them to a local nursing home. Let’s come together! @LLSWHS @WickliffeHSpic.twitter.com/e5gaRomacC,,@wickliffeschools @LLSWHS @WickliffeHSpic,,1.23884E+18,https://twitter.com/KrewWhs/status/1238843698554773510
3/14/2020 15:05,jhln28,,0,0,0,Have you ever felt so anxious that it feels like all of your nerve endings have been lit?,,,,1.23884E+18,https://twitter.com/jhln28/status/1238843637779156992
3/14/2020 15:02,jessimacaaaaaa,,0,0,1,As someone who has agoraphobia (I panic when I feel trapped by people) this virus has forced my therapist to stop exposure therapy with me and I might have cried when I just got his email. Like us social anxious beans are lowkey thriving rn,,,,1.23884E+18,https://twitter.com/jessimacaaaaaa/status/1238842918166769666
3/14/2020 14:48,_Niyaaaa_,JheneAiko,0,0,0,Anxious https://twitter.com/JheneAiko/status/1238676436749148161 …,,,,1.23884E+18,https://twitter.com/_Niyaaaa_/status/1238839405105774593
3/14/2020 14:44,VidalioCrudo,cbado23,0,0,0,Great photo! We are all anxious for your safe return.,,,,1.23884E+18,https://twitter.com/VidalioCrudo/status/1238838497273880577
3/14/2020 14:41,GadgetSGarcia,,4,0,33,"Her tenacity and determination gives me a boost when I’m starting to feel lost and anxious about everything going on. Babies live in the now, focus on one task or hurdle at a time my friends, we’ve got this. pic.twitter.com/q9NS1ScxEu",,,,1.23884E+18,https://twitter.com/GadgetSGarcia/status/1238837564120973312
3/14/2020 14:37,latenightsmkay,,1,1,6,there are 25 people outside of the Aldi next to the store I just went to. This is all so fucked up. I hope this blows over. i’m so anxious.,,,,1.23884E+18,https://twitter.com/latenightsmkay/status/1238836648147849218
3/14/2020 14:37,WorkingActuary,ceraldi_carleen,0,0,0,"Nominated for #FunnyTweetOfTheDay. Thanks Carleen, I just got back from Costco, there was extra stock but some people were anxious and it was disappearing fast. https://twitter.com/ceraldi_carleen/status/1238819877197991936 …",,,#FunnyTweetOfTheDay,1.23884E+18,https://twitter.com/WorkingActuary/status/1238836610239811585
3/14/2020 14:35,GriffRoss,,1,0,1,I’ve never been this anxious about donating blood,,,,1.23884E+18,https://twitter.com/GriffRoss/status/1238836173889581056
3/14/2020 14:35,EmilyHatzar,Cassiesmyth,1,0,15,One thing I was always irrationally anxious about when I was younger was the possibility of being on 50/50 and not knowing when to get up or where to go if my number was called lmao https://twitter.com/Cassiesmyth/status/1238819213176737792 …,,,,1.23884E+18,https://twitter.com/EmilyHatzar/status/1238836123985752064
3/14/2020 14:31,katieleedee,cliotropic,1,1,2,Thank you for this advice. I’m especially anxious right now and this sounds like a great way to just let out my feelings.,,,,1.23884E+18,https://twitter.com/katieleedee/status/1238835248026222593
3/14/2020 14:20,Wardwendy,TStancin,0,2,10,#psychologists at @uamshealth think #Telepsychology is a great resource during times like these. People are anxious. We can help!!! https://twitter.com/TStancin/status/1238817923386552321 …,,@uamshealth,#psychologists #Telepsychology,1.23883E+18,https://twitter.com/Wardwendy/status/1238832462865862657
3/14/2020 14:16,SchmidtChemist,Mrpchemistry,0,0,1,Thanks! We had PD on Friday and I gave a test Thursday so I am anxious and eager to see the Ss on Monday to try these out with a large class.,,,,1.23883E+18,https://twitter.com/SchmidtChemist/status/1238831365837205510
3/14/2020 14:15,SloppySenpai,SloppySenpai,0,0,0,"I hit, but I ran into some serious red flags like some sketch shit. Tryna ignore it while I’m cuddling I’m too anxious though like idk what to do... https://twitter.com/SloppySenpai/status/1238706918757224448 …",,,,1.23883E+18,https://twitter.com/SloppySenpai/status/1238831061313912834
3/14/2020 14:10,AileenReyes_,,0,0,0,I just had coffee from DD bc a 16 hour shift requires it but now I’m feeling anxious af and idk what to do,,,,1.23883E+18,https://twitter.com/AileenReyes_/status/1238829907578421250
3/14/2020 14:07,AileenReyes_,,0,0,0,One of the reasons I don’t like drinking coffee when I’m working: Makes me anxious,,,,1.23883E+18,https://twitter.com/AileenReyes_/status/1238829128100478977
3/14/2020 14:06,nngower,,0,0,7,"It does NOT mean navigating an LMS or understanding the way that many non-digital natives interact with (and organize) online learning materials. Let’s be kind to our students. They really do want to do good work, and they are anxious—on top of concerns about #coronavirus",,,#coronavirus,1.23883E+18,https://twitter.com/nngower/status/1238828910189608968
3/14/2020 14:04,1Laura4Pete,,0,0,3,PS...I think we all know that they ARE being tested and tested often. They just don’t want to tell us that because then we get more anxious that we don’t have access to tests. They NEED to self-quarantine. #SkypeIsGreat,,,#SkypeIsGreat,1.23883E+18,https://twitter.com/1Laura4Pete/status/1238828352544399368
3/14/2020 14:03,fairvictorious,Nancy47459,1,0,1,Not scared exactly. Somewhat anxious. My job isn’t something I could do from home; the whole place would have to shut down. I’m also pretty annoyed that the US had an opportunity to be better prepared and failed.,,,,1.23883E+18,https://twitter.com/fairvictorious/status/1238828181316132865
3/14/2020 14:00,janjowen,helen_a15,1,0,0,I feel really anxious as well. I will pray for you.,,,,1.23883E+18,https://twitter.com/janjowen/status/1238827303150419968
